{
  "contract_version": "1.0",
  "gateway_id": "11111111-1111-4111-8111-111111111111",
  "batch_id": "44444444-4444-4444-8444-444444444445",
  "messages": [
    {
      "message_id": "88888888-8888-4888-8888-888888888881",
      "point_id": "77777777-7777-4777-8777-777777777777",
      "data_type": "boolean",
      "value": true,
      "observed_at": "2026-07-30T12:02:00.400Z",
      "quality": "good",
      "source": {
        "kind": "controller",
        "id": "ventilation.controller"
      }
    },
    {
      "message_id": "88888888-8888-4888-8888-888888888882",
      "point_id": "33333333-3333-4333-8333-333333333333",
      "data_type": "boolean",
      "value": true,
      "observed_at": "2026-07-30T12:02:00.400Z",
      "quality": "good",
      "source": {
        "kind": "actuator",
        "id": "ventilation.fan"
      }
    }
  ]
}
