{
  "contract_version": "1.0",
  "gateway_id": "11111111-1111-4111-8111-111111111111",
  "batch_id": "44444444-4444-4444-8444-444444444444",
  "messages": [
    {
      "message_id": "55555555-5555-4555-8555-555555555552",
      "point_id": "22222222-2222-4222-8222-222222222222",
      "data_type": "float",
      "value": 25,
      "observed_at": "2026-07-30T12:01:00+00:00",
      "quality": "good",
      "source": {
        "kind": "sensor",
        "id": "climate.temperature"
      }
    },
    {
      "message_id": "55555555-5555-4555-8555-555555555553",
      "point_id": "33333333-3333-4333-8333-333333333333",
      "data_type": "boolean",
      "value": true,
      "observed_at": "2026-07-30T12:01:00+00:00",
      "quality": "good",
      "source": {
        "kind": "actuator",
        "id": "ventilation.fan"
      }
    }
  ]
}
